,Oct 01,Oct 02,Oct 05,Oct 06,Oct 07,Oct 08,Oct 09,Oct 12,Oct 13,Oct 14,Oct 15,Oct 16,Oct 22,Oct 23,Oct 26,Oct 27,Oct 28,Oct 29,Oct 30,Nov 02,Nov 03,Nov 04,Nov 05,Nov 06,Nov 09,Nov 10,Nov 11,Nov 12,Nov 13
0,It’s insane that just pressing the right buttons on your phone can payoff more than any hard work over a lifetime.,This is another proof that low income people are at more risk to get covid.,Imagine being hospitalized with a deadly pandemic disease and the only thing you want to do is pump the stockmarket,Upvote if you thought you were an intellectual and started trading.,Upvote if you’re retarded,"I had a dream that I started dating the daughter of a SoftBank executive just so I could learn what they’re planning to pump next, but when I snuck into the office in their house to read the papers on his desk, I realized I couldn’t read Japanese.",anybody else just feel empty lately lol like shitt it's almost mid October but legit didn't do shit all year,Congrats - now don’t gamble their college fund,AAPL fucked me so hard last month I will never touch that shit company again,stock is up 105% on the year but down 1% on the day,My apple calls i paid $6400 for is now worth $12,If covid couldn’t kill Chris Christie’s morbidly obese ass then I think we’re going to be okay,born too early to explore the universe,"I propose a new rule: if you use the terms “mooning” or “dumping”, you have to follow it up with the daily % change.",Every like on this comment I will not masturbate for a day,No stimulus means hope for stimulus.,If you think about it this all goes back to when we killed that gorilla.,"Upvote stuff that supports my opinion, downvote everything else.",I am now a long term AAPL investor. Not by choice,"Thank god for the lockdown news, imagine if good news came out we would be blood red right now",Just told my dog that today is Election Day. He had no idea. Couldn’t believe it,,If they keep delaying the final result we will forever live in green paradise as stocks rise on hopes of having more certainty.,If these Chinese stocks keep booming I’ll be able to afford the choicest cuts of bat at the wet market,This is an extinction level event for bears holy fuck,Tech acting like with vaccine nobody will ever need a computer again,"TikTok says the Trump administration has forgotten about trying to ban it, would like to know what’s up - TheVerge",I’m a big fat titted man but I’ve lost 15 lbs in 3 months with diet and exercise. Calls on my self-esteem.,we beijingbets now
1,"Anyone can do it, but most people just get shit on and regret even trying.",Edit: thanks for the gold!,God bless him he's looking out for his homies,Even worse I thought I was better than average.  Turns out I’m much much worse,"Trump reverses course on coronavirus relief talks, dangles new $1,200 stimulus checks",4D chess,Feels like a lost year,Congrats to your wife and her boyfriend.,Sent from iPhone,“Omg why did the market crash? What happened?!”,🤪🤪🤪,Yeah man just go to the ICU for free as soon as you test positive. Why isn’t everyone doing this?,born too late to explore the earth,I’m sick of you tards dropping 🚀🚀🚀 for (+0.23%),Calls on wet dreams,No stimulus mean no stimulus forever unless Biden win clean sweep,Bro,"""WSB SHOCKED TO FIND OUT AFTER 4 RED DAYS, THERE IS A 5TH""",Fuck this. I'm just going to sell crack.,especially if stimmy passed,"Guys, I'm concerned about the election. I don't think Kenye is going to win.",No bans will be issued for posting there about politics. We hope it will keep this thread relatively politics-free.,"Everyone is acting like the market is up because there’s a republican senate and a democrat president but they forget how everyone said the market is pricing in a Biden win and a democratic senate Monday, and when trump was up during Election Day everyone was saying it was pricing in a trump win. This leads me to believe nobody knows shit",For every upvote I’ll pump 500k into NIO.,Bears having a worse week than the minks,i heard McAfee developed the anti-virus,LMFAO 😂😂😂,Edit: holy shit thank you all so much for the words of encouragement. I love you beautiful autistic people. NIO TO THE FUCKING MOON🚀🚀🚀🚀🚀,don't let Chinese EV distract you from the fact that DJ Khaled has been working out for 10 years and still weighs the same
2,It's the hard work that goes into making sure you press the right buttons that everyone here forgets to do.,"Now that Donnie has to stay at home, he should open a twitch stream of daytrading",tbh we’d all be the same,Doesn’t it feel like AAPL and TSLA have been in jail for being August’s most naughty stonks?,This fucking guy 🤬,The Cheesecake Factory looks like a restaurant poor people think rich people might eat at.,You’re not alone. Don’t lose the decade.,"For real, though. Congratulations, you beautiful bastard.",My cousin works at SPY he said they are low on red candles but just got another big shipment of green,There’s more pussy in here than a Las Vegas whorehouse,Diamond hanz from $5.40 to $0.01🤪🤪🤪,"As soon as we all get the same quality of healthcare, sure.",born just in time to buy tsla FD's,My dick is currently mooning (+0.05%)!,The economy is so bad that I just got a pre-declined credit card in the mail.,Else same stalemate,Our sweet prince,This hasn't aged well,This is the most responsible comment I’ve seen in here for weeks,Puts on solar stocks. Daylight savings means less light to absorb.,I think Jeb has a good shot, Pre-Election Election Discussion Thread,Turns out Biden was the greatest 🐻 slayer of them all,Pour one out for all the homies we've lost along the way -,Bears: STOP THE COUNT,Josephine Biden better pump this shit or you ain’t black,I got a date tonight. Today determines whether or not we both split 10 nuggets or each get a 20 piece meal,15 lbs is 6.81 kg,This is cool dude. Weaponized autism vs cancer.
3,⬆️⬆️⬇️⬅️➡️⬅️⏺⬅️🔼➡️⏺,Maybe he can play Minecraft with Barron,LOL THIS DUDE LEGIT JUST SAID,"""$400k a year really isn't that much money"". CNBC assholes showing how out of touch they are","Snip snap, snip snap","I told my gf this when she really wanted to go there. Told her it wasn’t all that. We went and she was incredibly disappointed, especially with the taste/cost ratio. Thankfully her bf picked up the check.","Fully slept through this year, Xmas and NY is gonna feel real empty",If a girl ever sends you some bullshit text about anything just reply with 😎,"Dude only 10 more bucks and my Portfolio is at fucking break even, merry fucking christmas to me",upvote if you’re retarded,Tsla 10k >182.  Hello brother.,Up .15%,That's a t-shirt,I'm going to tell HR I'm the least racist person in the room,Fuck that's standup material right there.,If republicans hold senate and regardless Trump or Biden win then no stimulus,I didn’t expect to cry this morning.,"my girl wants to make an onlyfans, im so proud for her to begin a new career. she's so ambitious <3","Every morning my younger dog diligently watches my older one eat breakfast, hoping she will leave him some. She never does, but he always checks. Kinda like me watching charts now that I think about it",Jfc,Market is rallying on the possibility of a nationwide Jeb Bush victory,Peri-Election Election Discussion Thread,Bears are actually so goddamn fuk,Tanker Gang,Imagine if you bought puts on Friday 🤡🤡🤡🤡🤡🤡,This retard market overreacting to everything,Either way I'm taking her to mcdonalds,what would you say is the NIO of exercises?,This is the rare few times that I'm super happy a gamble paid off. Go get that shit treated!!!
4,My calendar just told me it's my three year anniversary without a cigarette. Keeping that addiction is probably less harmful than an options addiction.,"To the guy I called a retard for putting his entire 401K in shorts, my bad king.","""401K. VOTE!""","If I ever find out which of you reported me to the SEC, it's on sight","""oh fuck the 'best' market shit the bed, tweet something""","Trump: ""there will be no stimulus""","I bought Microsoft 365 suite 1 year subscription. And if I refer others I get a commission. So yeah, I guess you could say, I’m partnering up with Microsoft.",Drives them nuts,Get out now (imo),Sold MSFT 115c last week,"My favorite part of deep red days is watching people try and ""coach"" their shitty position like it is in a fucking Little League game.  ""Yeah, you can do it 10/16 AAPL $135C!"".","What is this, a rally for ants?","The economy’s so bad, Exxon-Mobil laid off 15 Congressmen.",Mnuchin Basically saying no stimulus till after election.,"It's 2525, Pelosi and Mnuchin have been dead for 500 years but",My entire portfolio is AMD calls wtf,I lost $15K over the last 2 days. I told my wife I was a business man... doing business.,Tell her I’m available to co-star in her films,That’s a beautiful comment. It’s like the gambling folks who constantly wager all of their paycheck and lose it all only to deposit it next week. We all are degenerates,1 more day until political ads are over 😍😍😍,Calls on guacamole bowl manufacturers,"Markets hate uncertainty, but we’re currently in a situation where we’re 100% certain that things will be uncertain. This is EXTREMELY bullish","""Spy will crash this week, Vix will be ath, buy puts!"" Never listening to you retards again, actually have no fucking clue what you're talking about lol 🤡",Cob Mob,I was about to but decided against it. Lost money on Friday but will be gaining it all back and then some today,"yes, fucking hate it.",At least you’ll save money by not getting a second date.,"My favorite strategy is buy calls after big Green Day’s, panic sell the day after when it does a healthy correction, buy back in later that day thinking I’m gonna miss the run up, ends up -5% after hours, panic sell at 9:30 am next day, account is -25%, I’ll just stay cash gang and wait for a bigger dip, 3 days later- same stocks are up 10% today. Start cycle again from the start","My new doctor asked me about my online investing during my phone check-up today. I thought she was interested in hearing about my trading skills which get me money, but then after I spoke for five minutes about it, she said she was concerned that I had a gambling addiction. She's obviously clueless"
5,Probably? I’ve never lost $100k on a cigarette,Boner he gets when he wakes up will leave him with stretch marks,I'm legit dying rn. THIS IS SO FUNNY WHAT THE HELL IS GOING ON HAHAHA,taking one shot per upvote just to make it through this,he's a fucking moron,"Pelosi: ""there will be no stimulus""","You publicly traded, if not when's the IPO. I'm all in",😎,Events in the US Today (EDT):,Sold AAPL 120c last week,Doesn’t hurt to try 😉,Brilliant,Mike Pence is short for Mechanical Pencil,Market: so you’re saying there’s a chance,Stimulus talks still ongoing,??? They obviously have to issue 20-30% more shares to purchase XLNX???? $35b??? They have nowhere near that in cash compared to NVIDIA or Intel. I feel like everyone was saying this on WSB. Massive AMD share dilution if they acquire XLNX.,Just not good business,Just walked downstairs and my retarded roommate is making chicken tenders for breakfast... Calls at open,Just got into work. Someone stole my nice Tupperware. Fucking neanderthals,1 more day until civil war ads start,If you riot today fuck you,uncertainty certainly priced in,Usually I do the opposite of whatever people in here are saying and it works out lmao,Silver Surfers,Up 350% the last 2 days. Down 16% all time.,I swear to god if I buy into this NIO meme and it tanks I'm gonna kill myself in minecraft,Don’t share your tendies.  Get her a freebie from the app.,Stop buying weeklies and your paper hands will stop selling so quickly.,Lesson one is Never tell people about your investing
6,(I only smoke weed though),"I can already hear the press conference two weeks from now: “flotus and I had it, but I gotta tell u folks iv had colds worse than this I mean .. the top doctors say i have tremendous antibodies, the best antibodies .. it’s true, ask fauci, birx..” Birx: 😑🧣","Oh fuck Donnie talking about stock market high again, we about to dump",Some dude from India followed my IG for some reason. He seems pretty chill so I followed back.,I kinda understand why this sub is so retarded now... You must think like the market. You must be the market,"""Markets rise 2nd day in a row on stimulus optimism""","It's 6am, you're a 65 year old retiree, you've just woke up from a long night's sleep (bed at 10pm). You check your brokerage to see that F, BA and IBM are all green. You take a sip of your coffee as you revel in your continued financial security.",very good,DAY - Wear a mask & socially distance <3,Sold NIO 22c yesterday,Damn AAPL really should have included that charger huh,McDonalds hash browns are $1.70 now? I'm now too poor to eat at this fancy restaurant,Calling this evening's headlines: 'Stimulus talks went well but major differences remain',"Tbf to mnuchin, Nov 3 is like 11 days from now. So at this point might as well not do shit. What difference would it make",Selling adderall from my parents basement is a far more lucrative approach,Idk. My puts on AMD and XLNX calls are :),My calls are socially distancing from the strike prices this morning .,That’s the only time you’re going to see tendies this week,"If you ever have a food thief at work, lace your lunch with laxatives and lsd.",Puts on Google and Facebook,I literally can’t think of a reason why were so green right now other to fuck bears,imagine being Mike Bloomberg spending a hundred million dollars on the state of Florida for Biden and Biden loses Florida. Could have bought Hertz calls,"Damn, errybody is getting paid. Except bears.",Purple Nurples,LETS FUCKING GOOOOOO,Welp,You all need to understand something. There are strong and there are weak people. You join the market because you want to be strong. But you are up against all kinds of oppression. People wanting to fuck you in every corner of life. So this is your outlet. You hope the money can bring you the freedom from other people’s tyranny.,Bears get excited about thousands of people dying just so they can make 100 bucks.,At this point i could catch my wife fucking her boyfriend in a NIO and all I could do is start clapping
7,"Nah man, that shit is a hard way to go out, keep it up!","Covid, stand down and stand by",Four missed calls from my ex around midnight. She is now married and has 2 daughters. I am single. 🤮,FB 270,This market never ceases to amaze me. I swear if I see a markets rise from stimulus hopes headline I’ll eat a sandwich for lunch.,"lmao I was talking to my neighbour yesterday and accidentally used the word ""gay bear""","and say quietly, “I love boomer life”",My girlfriend gets mad at me and tells me I care more about stocks and bonds than her.  Which pisses me off because it isn't true at all.....I don't own any bonds.,6:00am - NFIB Small Business Optimism (Sep) [1/3 Volatility],🤡 🤡 🤡,Fact,Fuck and they don’t even serve breakfast all day anymore in my town. Puts on McD,“another phone call expected tomorrow though”,Pro trader rule #1: Don't hold through earnings,My boss is fucking retarded but not in the good way like us. Complains we don't have enough time to work then schedules a 4 hour zoom meeting. Fuck you Tony you fucking gay,I picked a bad time to stop being a pussy and finally trade options.,V responsible.,Monday: Buy the dip,Events in the US Today (EDT):,I see so many people scared to make plays or leave money in a volatile market. This sub was made for weeks like this. It separates the yacht owners from the  paddle boat renters. Do your research and make your plays. This is what we live for!!!!,"well yea, too many puts out there",and another 200mil on TV ads only during his campaign i think,As it was and always will be. Forever and ever. Amen.,Clang Gang,Pfizer: saves the world through science->up 14%,"Moving into a new house while cutting 400 dollars off rent per month. That money is going directly into weeklies every single time, girlfriend thinks it’s going into “savings”. The fuck is that?",Literature on WSB? what simulation i'm i in,I bought nio in January at $4 and sold when It hit $2. AMA,Every NIO shareholder right now:
8,This must be a pretty long rug,I don’t wish harm to Donnie in any way but if he turns out to be entirely asymptomatic we’re never going to hear the end of how much of a hoax it is,You won. Trust me man.,Long $BOB $VGNE,Mods,"just saw his wife outside today, she always says hi but today it was obvious she tried to avoid me.",People who write APPL instead of AAPL deserve to lose money on it.,😎,7:00am - OPEC Monthly Report [2/3 Volatility],Girlfriend said I could buy a new tv if I made 600 bucks in the stock market.,"As a millennial that created this overpriced stock market, I wonder what economic disaster or global atrocities I'll have the honor of being blamed for next week",The USA economy is literally all ipad on a pton bike while everyone is on zm conference calls,Farmers and airlines get billions of dollars in socialist style handouts = no biggie,Me: 🤡,Middle management America. Days full of meetings and bullshit buzz words to circle back on,"Another day, another 25% of the sub wiped out",I'll save the market today.,Tuesday: Buy the dip,DAY - Wear a mask & socially distance <3,Research = flip a coin,I’m buying a pallet of bricks and driving around downtown SF tonight. $3/brick cash only.,"WSB is wholesome af. We probably have an even split between Joe and  🥭 and we all come together, united in our mission to lose as much money as possible.",As is tradition,Team Rocket,Carnival Cruises: gets boomers drunk on a floating port-a-potty -> up 32%,Bruh can't stand the TOXIC matriarcy We should be able to do what we want,"You ever just find yourself sitting in the darkness, just thinking about all the years that have flown by? Davos wasn't kidding when he said nothing in life fucks you harder than time. Where do the years go man?",Buy back in at $45 and sell at $25,"""I should've bought more"""
9,This market is legit batshit crazy.,Maybe he lies about having it so he can claim he beat it? Also doesnt have to do any debates anymore.,Lol imagine the other guy though. His wife is ringing her ex at midnight.,I remember in high school busting my ass for 38 hours a week at Kroger just to make 220 bucks. God I was such a cuck.,,i guess it's time to move,"All I want in life is a $10,000 emergency fund and a $10 million+ portfolio.",Holy fuck it's all tech,8:30am - Core CPI (MoM-Sep) [3/3 Volatility],So far I only need $713 more.,putting airlines on the brink of bankruptcy by not going on vacations during a global lockdown while being unemployed,Daily reminder that you're part of the greatest psychological experiment of all time,I ask for another $1200 check so I can buy a FN Five-seveN = shut up you commie,Do you write it on a whiteboard and still ignore it?,2 red Mondays I'm sueing the SEC,I love the smell of napalm in the morning,I'll buy puts at open.,Wednesday: Buy the dip,8:30am - PCE Price Index (MoM&YoY-Sep) [2/3 Volatility],gonna be honest if you would have told me after the uk announcement of lockdown that markets would be this green id have called you a dog faced soldier pony,Ahh a businessman doing business,Wsb is what politics claims to be,Softbank we know you are here just let us know when are u going to dump,Knights of the Vale,AMC: James Bond goes brrrrr,Amazon had a nice run but now that we don’t use technology anymore it will go to $0.00 EOD,Amazon,The fed has distorted markets to the point where you can't even predict whether a business shutdown is bullish or bearish for the stock.,"Why didn’t I go all in on NIO, refinance my house on NIO, take out a 30k loan with 14% APR to buy more NIO 😭"
10,Rocket on stimulus talks.,"If fucking Boris and Bolsonaro recovered from this shit  but orange man dies, it’s gonna make America look real bad","As always whenever someone needs to read this, you leave that shit on read or ignore. don't you fucking respond. tendies > bitches",Now I stress 24/7 about risky plays and am lucky if I only lose 220 bucks a day,Imagine thinking people are actually concerned with the operations of  these companies and aren't just trading them like baseball cards.,How tf did gay bears sneak into your conversation?,Is that really too much to ask for???,Always has been 🔫,8:45am - The Senate holds a pro forma session,Edit: can't buy a TV with reddit silver but thanks anyways,Not buying a brand new cell phone every 6 months like analysts have priced in.,Experiments have control groups,"""farmers""","Don't worry, you'll get there",Hello SEC this is a retail trader...hello?,GME gonna release their vaccine today or is that later this week?,Thanks for your sacrifice my son,Thursday: Buy the dip,Employment Cost Index (QoQ-Q3) [2/3 Volatility],Imagine being a...,You should sell wood boards too. They’ll be in demand once business owners catch wind of someone selling bricks downtown.,Bought 200 nio at 16.73 and let’s just say a nigga eating with the white folks now shiiiiii 🥴🥴🤣🤣,SPY almost at 2% premarket after a 2.5% day. Exact opposite of march but everythings still as shitty,Battery Day Bros,There's one guy here who's watching all of these stocks moon to astronomical levels and knows as soon as he hops in we hit a circuit breaker....,This has turned into a real hobby now that I’m only losing money,"Literally the other night.  Started feeling down thinking about all the memories.  The sad thing is that once you realize how little prime time you really have, its mostly already gone.",False,imagine not buying companies that can photoshop their earnings reports with no consequences
11,Rocket when stimulus talks end.,Boris and Bolsonaro aren’t morbidly obese old hamberdlers,"Lol, orange just pumped the market again. This is literally what it’s all about.","Remember battery day, fucking disaster. The honking still haunts my dreams.",Boomers trade baseball cards. No this is Pokémon card trading in elementary school where no one knows the actual value of the card,Sus,GME is gonna wipe out another half of the sub today isn’t it lol,WSB: dOnT hOLd caLLs oVeR wEeKeNd bOyS,10:00am - IBD/TIPP Economic Optimism [1/3 Volatility],Hey you. Yes you. Do yourself a favor and chug 16 oz of water Rn.,Sir this is a gloryhole,Calls on Big Titty Goth Girls,"""International food conglomerates that lobby the shit outta DC""",Not cool of Biden to call us out last night with the “poor boys” remark.,Financially ruined by open,"No stimulus, media scaring everyone about the virus, craziest election in history, most overvalued stock market in history, middle of a pandemic, seems like a sign to me. Calls it is.","I can’t wait for “Guys MSFT beat earnings and is only down 2%, why is my weekly OTM call down 98%?”",What fucking dip do you want me to buy? I already got salsa and ranch.,Real Personal Spending (MoM-Sep) [2/3 Volatility],looks at futures,,Never forget michael bloomberg his run for presidency😂😂 top retard,Feels better than March to me!,And the yolo SPY put guy who was 2 days to early.,It's me I'm that guy,My portfolio is apparently anti vaxx,Gonna sell my Nio calls so it goes up and the rest of you guys can enjoy those tendies,It’s bullish. Always bullish.,"WSB isn’t supposed to be this profitable after spamming a ticker, something is wrong here"
12,NKLA is the epitome of this market.,this is serious. Even NKLA is down,“BIG TIDDY GOTH GIRLS. VOTE!”,HONK 🤡 HONK 🤡,,If you want to show dominance you’re gonna have to fuck her husband on their lawn,This is the way,"""This thing works sometimes, definitely a good idea to do it all the time during election season""",11:00am - Cleveland CPI (MoM-Sep) [1/3 Volatility],Thank you for the reminder,Remember: Drink water often & Stretch your cock for maximum length,Does anyone just randomly think about the bad trades they have done and then chuckle sadly,They're the same thing.,BREAKING NEWS: NANCY PELOSI PREGNANT FROM ALL THOSE MEETINGS WITH MNUCHIN!,Man I fukin miss the high volume on this sub. What the fuck happened,AMD gang rn:,don't tell them,it’s a 7-layer dip bro,9:45am - Chicago PMI (Oct) [2/3 Volatility],Ha! Imagine being a bear,futures rise on election sweep hopes,“Probably too late to jump in on NIO now”,,🍺,Fuck that noise.,Why is tech down?,Thank you brave soldier,i feel like my generation is so far behind that i need to gamble to get to where older generations were handed for free,Yeah I didn't get on NIO because of the wsb curse but looks like it's time 70% of us became millionaires
