216,Celebrities are weird as fuck,The Science mocker in chief has the 🦇flu,News comes through WSB faster than CNN and FOX. Wtf.,"blew up my account for the 6th time, I think im done boys gg",see you guys on the other side,did you just realize markets are rigged and people trade inside all the time,I was really planning to hold GME for the long term anyway it’s a great company 😂😂😂🤦‍♂️🤦‍♂️🤦‍♂️,Why did I even trade in September 😡,"""'Get long' — Cramer sees coronavirus trends driving stocks higher no matter who wins election""",See you tomorrow yachtking4,,Nothing is better than hearing the opening bell with coffee and a cig in your hand,◥█████◤,fuck everyone that said to buy snap puts yesterday,I was up all night just ruminating over the plethora of choices...,GME announces partnership with ORECK vaccuum to provide cleaning services to each store - shares rise 50% stock halted,sector rotation into tupperware,if gme could go to $200 by EOD that would be tight,Who remembers in March when Trump was having a press conference with a bunch of CEOs on stage and SPY pumped 5% in the last 30 mins? Shit was wild,A civil war won't happen when people still have a roof over their head and food to eat. 99% of humans just want comfort and security and aren't willing to risk anything for all this political hysteria that doesn't affect their life.,daily reminder that VXX is a scam,Fuck! The market is so manipulated.,NIO $50 Tomorrow.,Earnings Before Open:,,"AAL and CCL be like “look at all these retards wanting to buy our shares, lets give them more!!!” 🤣🤣🤣🤣",I told my wife I'm not losing money by YOLOing in Robinhood. I'm just pre-revenue.,waiting for that NIO dip like 🤡,"Wait so you're telling me NIO tanked right before a earnings report that will be stellar, and after an election that will allow them to sell fully in the US most likely, just because 1 short seller said a negative thing about the stock? That's the market I guess."
217,upvote if you’re retarded,😂😂😂😂😂😂😂😂😂😂😂😂😂😂😂😂😂 Perfect,Mfs in the WH passing around corona like it’s a blunt at a high school party,Only thing not priced in at this point is an Alien invasion.,,"If you guys don’t go on a morning run, you are missing out. I go run a few miles and come back to have a few coffees and I’ve never been so dah damn excited for this market to open","AMD, you doing okay you big fucking stupid fat fuck autist?",SELL AND TAKE PROFITS U DUMB FUCKS BEFORE YOU COME BACK TOMORROW SAYING “What why am I down smh I was up 500% yestarday I should have taken profits 😢😢😢”,9 hours later:,"I have NIO 10/16 $24.50.  If those end up being worth something, Oktoberfest sausages are on me.",This morning:😳 This afternoon:😎,All I need is 30k then I could make so much better plays 🤟😞,══╩══╩═,The good thing is when you lose 5% of your portfolio every day that -5% is a lower total loss every consecutive day.,Then I woke up and bought 0TDE Spy puts. Oh baby.,All China stocks mooning assuming sleepy is winning election?,Bulls who “bought the dip” lol,Bulls can lick my entire ass crack,You’ll either be a straight genius 🧐 or a complete fucking spastic 🤤 buying this dip.,Mike Pence is short for Mechanical Pencil.,just FOMO’d the shit out of Nio 🤡,The whole market bought puts and here we are with +300 points with presidential election uncertainty,NIO can’t be stopped,"CVSHealth, Enbridge, ViacomCBS, ImmunoGen, Telus, Marriott",whos buying nio calls?,"if you think you fucked up today, i went all in on BABA calls yesterday at 3:55 pm thinking it would never be that low again. Woke up this morning to -85% and debating whether i should ever open robinhood again.",You think she'll let me back on the bed?,Trump supporters could have all their positions wiped by Trump's decisions and still want to suck his dick.,"I've lost 240k on NIO, all my life savings. Now I'm broke af."
218,When premarket starts fading I just start screaming at my computer as loud as I can and it comes back about 5% of the time so you’re welcome,You're telling me that preemptive hydroxy he was taking didn't work???,Cuomo pussy footing around calling out the Orthodox Jews,Asteroids have been priced in for a long time.,Just want to break even before tax season so I can hide my 13k loss from wife.,Lmao mangos like naw fam we either doing this in person or it ain’t happening,My VALE calls are up 140%,Imagine not holding calls over the weekend,"""Jim Cramer: Another day, another rally where stocks 'go up on nothing'""","LETTTTTSSSSS FUCCCCKINNNNNGGG GOOOOOOO YOU CUNTS, GOOOOOOOOOOD FUCKING MORNING. RETARDS UNITE",The warning was given 2 days ago but instead y’all fuckers made DIX a meme,Every time I see a FDX driver I try to ask him/her how it’s going.  NEVER get anything besides busy as fuck 25/7.  🥰🥰🥰,╬═╬,That’s the bright side right?,🟥🟥🟥🟥🟥🟥🟥🟥🟥🟥🟥🟥🟥🟥🟥🟥🟥,My entire portfolio wiped out in a day... rope time.,me bull small brain,I have lost 10k this week so far. Never have I lost this much in such a short amount of time,"Good luck boys, debrief at 1600",⣿⣿⣿⣿⣿⣿⣿⣿⣿⣿⣿⣿⣿⣿⣿⣿⣿⣿⡿⠿⠿⠿⠿⣿⣿⣿⣿⣿⣿⣿ ⣿⣿⣿⣿⣿⣿⣿⣿⣿⣿⣿⣿⣿⣿⣿⠿⠋⠁⠀⠀⠀⠀⠀⠀⠙⢿⣿⣿⣿⣿ ⣿⣿⣿⣿⣿⣿⣿⣿⣿⣿⡿⠟⠛⠁⠀⠀⠀⠀⠀⠀⠀⠀⠀⠀⠀⠀⠹⣿⣿⣿ ⣿⣿⣿⣿⣿⣿⣿⣿⣿⣿⢁⠒⠀⢀⡔⠂⠀⠀⠀⠀⠀⠀⠀⠀⠀⠀⠐⢹⣿⣿ ⣿⣿⣿⣿⣿⣿⣿⣿⣿⡇⠀⠀⠀⠀⠀⠁⠀⣄⠀⠀⠀⠀⠀⠀⠀⠀⠀⠈⣿⣿ ⣿⣿⣿⣿⣿⠿⠟⠛⠛⠓⢄⡀⠀⢂⠀⠀⠀⠀⠠⡀⡌⠀⠀⠀⠀⠀⠀⢰⣿⣿ ⣿⣿⣿⣿⢁⠄⢀⠀⠀⠀⠀⠈⠢⡄⠁⠀⢀⣀⠀⠘⠀⠀⠀⠀⡀⠀⣠⣾⣿⣿ ⣿⣿⣿⣿⣯⡂⠀⠀⠀⠀⡀⠀⠀⠈⠢⡀⠀⠀⠀⠀⠀⡠⠔⡞⣡⣴⣿⣿⣿⣿ ⣿⣿⣿⣿⣿⣿⣦⡠⠈⢦⡀⠀⠀⠀⠀⠱⡀⠀⠀⠀⠀⢄⣾⣾⣿⣿⣿⣿⣿⣿ ⣿⣿⣿⣿⣿⣿⣿⣿⣆⢢⣿⣄⡀⠀⠀⠀⢐⠀⠀⡀⢐⠆⣹⣿⣿⣿⣿⣿⣿⣿ ⣿⣿⣿⣿⣿⣿⣿⣿⣿⠀⣿⣿⣿⣄⡄⠀⠈⠀⠀⠁⣶⣿⣿⣿⣿⣿⣿⣿⣿⣿ ⣿⣿⣿⣿⣿⣿⣿⣿⡁⢘⣿⣿⣿⣿⣿⡀⢀⠀⠀⢸⣿⣿⣿⣿⣿⣿⣿⣿⣿⣿ ⣿⣿⣿⣿⣿⣿⣿⣿⣿⡸⣿⣿⠏⠻⠟⠀⡌⠀⠀⢸⣿⣿⣿⣿⣿⣿⣿⣿⣿⣿ ⣿⣿⣿⣿⣿⣿⣿⣿⠟⡋⠀⠀⠀⠠⠐⠉⠀⠀⢀⠨⠙⢿⣿⣿⣿⣿⣿⣿⣿⣿ ⣿⣿⣿⣿⣿⣿⣿⠁⠀⠆⠀⠀⠀⡀⠄⠀⠀⠈⠀⠀⠀⠘⣿⣿⣿⣿⣿⣿⣿⣿ ⣿⣿⣿⣿⣿⣿⠏⠀⠀⢠⠀⠀⠈⠀⠀⠀⠀⠀⠀⠀⠀⠀⠛⠛⠻⠿⣿⣿⣿⣿ ⣿⣿⡿⠛⠉⠀⠀⠀⠀⠈⠀⠀⠀⠀⡄⠀⠀⠀⠀⠀⠀⠀⠀⠀⠀⠀⠈⠙⢿⣿ ⣿⠋⠀⠀⠀⠀⠀⠀⠀⠀⠀⠀⠀⠀⠀⠀⠀⠀⠀⠀⠀⠀⠀⠀⠀⠀⠀⠀⠈⢻,If we open green tomorrow we're never having another red day for like 2 months straight,Remember last week SPY was at $322.8 lmaoo,Come on NIO you slut break 40,Don’t say the ticker.,Do not fomo at open. Wait for the dip at 10. You'll regret buying early.,Tech so fucking oversold,Everyone on WSB including their grandma is in NIO,Lololol at stupid NIO put buyers,New CEO of NIO announced: Sum Ting Wong
219,Airlines are an amazing sector- You do well and you get to keep the Profits; You fuck up and you get bailed out,Stimulus passed the house,Bro I would hate for my dad to be Cuomo. Can you imagine his fucking lectures?,Rapture. Priced in.,I got a job offer boys,Unemployment claims don't matter because O P T I M I S M on S T I M U L U S. This shit is a joke.,I forgot I bought these,"watch stimulus be a buy the rumor sell the news event, it finally passes all the way through and we drop more than june and august, just to fuck everyone",Jim Cramer's whole career is being a surrogate for retarded retail investors who are hopeful for the future yet flabbergasted they missed yet another market move.,Give this retard a tranquilizer to calm him the fuck down,Y’all are the fucking memes 🤡🤡🤡,Hertz got a massive 1.65 billion in financing. Next Kodak confirmed,╬═╬ just dropped down to say,Wtf is with this Democratic states bullshit they keep talking about with the Stimulus?,One of the problems traders make is that they lose sight of the money. They can't conceptualize how much money they are risking with each trade. They start just seeing numbers.,What a fucking joke lol.,bull see line go up,So many chances to exit calls. Hope you all are taking advantage,Fake pump premarket,Market rises on election uncertainty,Mango in shambles. Couldn’t hire Big Pump and could only bring his brother Little Pump on stage.,WILD,"NIO $420 ""Funding Secured"".",You know which one.,CEO of Spy to announce stock split,Went from 3k in March to 26k on Friday to 7.5k today lol,surely this will end well!!!,"Wow this NIO horde is legit getting annoying in here, there are other stocks too guys",Lot of NIO butthurt bois going through the comments and raining downvotes.
220,"I finally found the porn video I’ve been looking for weeks... calls on everything, this is super bullish",Dumb orange fuck has the virus,HOLY FUCK THAT TWEET IS HISTORIC,Egyptians opening up shit they shouldn’t. Priced in.,"Jesus Christ, I got laid off a month ago, and I’ve already made my annual earnings after taxes in only a span of a week thanks to options","She said, ""Where we goin'?""🌚  I said, ""The moon"" 🌝",VALE long calls are the way,"My aapl 115 sept 2021 calls I bought at 104... Ive never been this ITM this early, I didn't think I'd actually make it this far. Probably gonna die now",Apple literally has said this is one of the most significant apple events of all time and yall wanna sell before hand lmao,Fuck September. All my homies hated September,Fucking France on lockdown again 😨,"For your average red blood American non trans male, is there anything more demoralizing than reading through twitter?",╬═╬,"CT, MA, NJ, NY, CA all contribute far more to the federal tax base than they get in return while leeches like MS, KY, WV and SC all get more than they put in.","So, let me impart one of my finest secrets of the pros. Rather than thinking each trade in dollars, think in terms of 4 for 4s at Wendy's.",Fuck a real job. I sell puts to bears and spreads to gays,brain itch,Spy 320 eow,Bulls: today is green!,This truthfully looks like a technical bounce off a double bottom from Friday With that being said we’re approaching overbought and we will for sure retest 323 later today/tomorrow so I’ll be loading up on more puts at open and unloading at 323 to see if we can crack it,Buying calls at the top and buying puts at the bottom. Name a more iconic duo.,Who else bought puts the day before the greenest day in the history of the United States of America???,Nï0 has taken me from a in the red 4 figure account to a +145% 5 figure account and I am gonna buy Chinese for lunch.,Yes that’s the one.,ROATION INTO AMERICA BOYS,Thanks baba,It’s sad but funny realizing how many literally lose their life savings here every day,I'll lick your sister's taint if NIO closes above $50 today.,"Remember, citron is the same company that said Tesla wasn’t worth investing into in February. Look how that turned out. These guys are professional short sellers, of course they’re gonna say negative things about a hot stock to get in on some nice price action."
221,VIX what is it boy? You trying to tell us somethin?,Why tf are stonks down?,"Doc: I’m afraid you have pneumonia, it’s very serious and I cannot, in good faith, allow you to leave the hospital for the next week.",Tupac found alive. Priced in.,This is a shit show. Everyone with calls is afraid. Everyone with puts also afraid.,"All my puts are red now,",I sense Su Bae's displeasure with a number of comments in here. We all know what happens when you anger the Bae 🤕,Mom said I look extra handsome today 👍gonna make me spaghettios when I get home from stonks,Sell the news if you want but shit went up last year after the iPhone event:,🟢🍆🟢🍆🟢🍆🟢🍆🟢🍆,"Bulls always say bears are ""betting against America,"" yet they are very literally praying for the USD to crash further to inflate their overbought stocks.",AMD back to 85 today.  I read The Secret last night and have decided to always put out positive vibes for my plays from now on,╬═╬ You’re hella gay 🌈,Fucking cretins man. Kentucky wouldn't even fucking exist if my tax dollars weren't propping it up and Bitch McCocksuck has the audacity to repeat mangos tired bullshit. I'm so over this stimulus shit.,"You're up $1,000 on that trade? You're up 250 4 for 4s at Wendy's. It's time to take profits",Any GME bag holders here?,brain say line no go down no more,If you aren’t buying spy puts right now idk what to tell you,I sincerely hope you guys buy calls at open,RED BY OPEN AGAIN?!,You're a lazy bastard if you dont go and vote today,classic epstein egg shape cock formation on tsla.  be careful with this dd,NIO will hit 40 by lunch,Yes my wife’s bf is doing great.,Accedentaly bought Pfizer Total Landscaping $PTL where to go for a return,"Helped me up, and helped me down",STOP THE COUNT,hell ill lick it for free,"NIOs volume is at 525m. Its avg volume is 133m, the whole market is trading NIO."
222,"cnbc: ""alcoholism is up""",Seems like good news to me,Mango: Just tweeted that I will be leaving. You’re fired.,OMG BREAKING NEWS: SOME KIND OF STIMULUS MIGHT MAYBE POTENTIALLY POSSIBLY HAPPEN SOMEDAY,someone here has to admit with me that it’s dumb that futures are up from 2 tweets last night. obviously he’s not going to be signing a stimulus anytime soon but this market is... retarded lmao,pushed me to the edge now,Thanks AMD,Wtf Donny shut up!,https://markets.businessinsider.com/news/stocks/apple-stock-price-reaction-to-keynote-tv-plus-new-iphone-2019-9-1028517100,HULK COCK WEDNESDAY,Bears are the real heroes. USD is more important that fucking ZM stock.,im jacking off so hard rn,╬═╬☻/ NO CAP,"Almost completing 1 year of trading, down 33.33% overall",RIP Permabulls 2020-2020 never forget,Man I never thought I could get so frustrated playing SPY,brain say line bottom now,"This sub seems literally 50/50 bull/bear right now, that's rare as hell.",IF YOU AIN'T BUYING PUTS AT OPEN YOU AIN'T BLACK,"If anyone on this sub tells you not to worry and that it’s just money, they’re wrong. That’s all we’re here for. Just come back with more and get better",No cash gang 😎,Sure I could’ve quadrupled my portfolio this past week if I hadn’t gone cash gang and just bought calls. But at least I didn’t bankrupt myself going bear gang,Friendly reminder to take profits.,Alright you too bro. GL trading today.,"Hey algos reading this, this is for you!",Spy is gonna either go up or down from here. You are welcome.,Raise your hand if you have puts,BREAKING:,
223,how dare u,Stimmy isn’t passing the senate,"Dude says that during Covid he feels better than 20 years ago. Fucking for real? I’ve lost the plot, boys",Lol just having trumps Twitter  open made me 30k,"Bear/bulls, whoever wins in the a.m....",Took a bong hit then AMD shot up,"people ask me, y did i choose gme? cuz u guys said michael barry been on it and there was 136% short interest... thats pretty compelling if you ask me, but idk bro...selling at open gonna be hard to resist because im truly retarded","ATH tweets, yeesh. Sell calls at open.",Apple baby 🚀 🌑,🟢🍆🟢🍆🟢🍆🟢🍆🟢🍆,🇺🇸🇺🇸🇺🇸💪🚀,So that “unusual options activity” for htz a few days ago for $3 calls was insider trading huh?? Good thing I followed it with some shares,╬═╬/▌,fuck it. im cashing out and buying a small fry at mcdonalds,“Markets rally on news that stimulus is finally dead”,Pencils down everyone ✏️,brain say line go up forever now,Obligatory fuck you to theta gang,Too many bears here downvoting bulls.  What does that mean?  Means market is going up!  Buy calls! Always inverse wsb,Lol NIO is gonna be meme’d into the mid 40s isn’t it,Stocks rise as investors laugh at WSB bagholding puts,"I mentally can't take 4 more years of this shit. Whoever wins, this country has already shown it's true colors",NIO $75 EOD can’t go tits up,Not gonna say NIO. Not NIO,whips out my male penis,Apple is gonna bounce between 110 and 120 for the next 30 years isn’t it,Anyone else tired of hearing about NIO,BULLS DEMAND A RE-PUMP.,NIO coming back next week bigly. The second resurrection of Jesus Christ
224,Internet: NO STIMULUS,Dumb orange man could’ve spread the virus to a lot of people,,I’m sorry but I can’t wait till this fucking moron is out of office. What’s the point of even tweeting that. Take his fucking phone away. You just shit the entire market in literally 5 minutes you fucking orange piece of human garbage. How is this shit even legal. Can you shut your fat fucking mouth for a whole day?  Jesus Christ.,If you don't take your profit....you ain't black,Going to hit more,Looks like reloading AMD yesterday was a mistake,"God dammit Orange Man, just shut the fuck up for one fucking day. I still haven’t recovered when he fucked the markets with his bullshit stimulus tweet. I’m barely clawing back right now and he has to go and whine like a little cunt nugget again. Just fuck off and leave my Wendy’s tendies alone ffs",NKLA and LOOP in merger talks,911 I'M GETTING RAPED BY THETA,Bear or bull. Winner or loser. I think we can ALL agree that what’s most important is that we’re all in dis dump TOGETHER 🤗,9AM LETS HAVE A GREAT DAY EVERYONE,╬═╬/ \,"No one is going to believe this, but here it goes.",should i buy the groceries my kids desperately need or buy weeklies?,damn Dennys actually beat earnings,bull make choice,AAPL bottom jeans,This is way more entertaining than actually working for a living,You guys are trading stocks and you don't know how to adjust your fucking watch? You truly are autistic.,Still thinking about Cardi B’s nipples,This fucking orange monkey is gonna throw the markets into turmoil.,All those 300Ps just went from -99% to -98%,Stocks rally on 7% unemployment and civil unrest,JOE BUYIN,Biden speaking right now is so much nicer than trump just saying “fake news” “democrats are bad” etc,"My dad went to Chili’s, wild Buffalo wings and dunkin donuts to get his freebies for Veterans Day. You’ve never seen a man so happy",BEARS FILE MOTION TO BLOCK.,+600% to -97.59% i don’t even fucking care. Just gonna drink myself into oblivion in Miami then face fuck this worthless bitch on my balcony tonight
225,algos: searching for keywords... 'stimulus'...,Stonks are down,imma stick to day trading for the next week or two ugh why will you not just stay in the dumb hospital until completely clear mr pres plz for my options,"This is Mango's final gambit. Vote me in, or no stimulus until Feb at the earliest. Damn the ordinary people. Damn the economy. Damn the markets. Batshit insane, but totally makes sense in his mind",isn't amd cpu coming out tomorrow?,Need AMD to come out with a vaccine rn,What dumbass decides to go all in AMD.  You should always diversify.,Why is solar dumping so hard,Going to buy AAPL calls at open so I can feel that retard rush again,"""This guy is holding his tesla shares despite being up 400%""",Jim Cramer literally goes from bull to bear and back twice in every fucking sentence.,It puts the stimulus on its skin or else it gets the tweet again 🥭,TSLA stock price too low imo,AMC headquarters is in my hometown. I rub shoulders with some high profile people occasionally. GME executives were recently meeting with AMC to offer e-sports streaming and stadium worthy events in their theaters.,"DRILL TEAM 6 REPORTING IN , IT'S TIME TO DESTROY THESE DELUSIONAL BULLS ONCE AND FOR ALL","this is why we cant have free health insurance, you fat fucks",bull buy top,Boots with the furrrrr,EVERYBODY STOP: The Mandalorian is back today,SP500 to 500 EOD,Hahahaha my puts are fuuuuuucked,God I'm a confused gay bear bull and idk what to do anymore,NIO announcing release of 100kwh battery and update of 150kw & BaaS service tomorrow 🚀🚀🚀,I thought the likelihood of Biden winning was pretty much well known information on Wednesday.,Thanks to all of you who said calls are free money today. Never listening to this sub again,Alright boys it’s 5 here and I didn’t mean to be up yet but I went to bed at 7:30,Buying NIO dips is literally free fucking money.,NIO's October sales were already pre-released just like XPEV. Interesting no one picked up on that. XPEV moved 40%+ today on ER. NIO had similar success in October.,Citron singlehandedly ruining the most beautiful concerted run ever
226,stonks: up!!!,Half America still sleeping and didn’t wake up to the news yet.. we will go down more soon just wait,I will keeping buying puts. Fuck u,Ya get 4 more years of this shit if ya vote for that fucking clown,You deserve to lose money if you think Nancy will agree to send 1200$ checks for Donnie to buy votes before elections🤣🤣🤣,AMD pump n dump lmao,"It’s me, I’m the dumbass",thank you Apple!,AAPL 130 eod call me crazy,Yeah because they're shares,"Advice for anyone not around for September. If today is red, hold off on ""buying the dip."" You don't know how low it might go or for how long, half this sub got wiped out that last month chasing never ending dips. Not much reason still to expect continued all time highs, so just be conservative and be careful.",why is my app green is it st patricks day or something i've never seen this,Frankfurt is pumping.,I’m not even fucking kidding.,Wtf Apple. It’s earnings week,AMD buying a $28 billion company for $35 billion. RIP call holders,line go down,And the whole club was lookin at ER,Bears panicking. Stfu and just wait damn!,Some personality maybe...,"I'm losing money. I'm not even mad, this shit is surreal",People are talking about 🥭 VS 💤 while In Reality we should be talking about 🐻 VS 🖨,HES COUGHING FUCK I NEED TO SELL,"Bears are once again, FUK",trump died for this - 8 year bull run begins now,So it’s time for some bong rips cheers,is everyone broke or are regular people not up at 521 am?,NIO $250 EOM.,As if we let NIO shit the bed on some lemon reporting lemon news. Made a similar claim about Tesla and went back on his word. Absolute joke
227,Steve Mnuchin starts the meeting “Websters dictionary defines stimulus as...”,"Mods: maybe tone down the automatic filtering a bit. Can't even say the name of the president anymore, the word él3ction is on the fucking list. And discussing this uncertainty is kinda very relevant to the markets now.","November 2029, ""stimulus talks going good""","I don't know why this sub is pro-Donnie. He's been causing this type of bullshit since he took office. The China trade deal, etc. Just one tweet and your weekly calls are shit.","I've lost well over $150,000 from not taking profit from winning positions and then watching them crumble down to nothing. Now watching 🐢🐢🐢 do the exact same thing. When will I fucking learn?","Amazes me how many truly retarded people there are in here.  If you have November or later calls on AMD, you are going to fucking print.  The chips they just announced are game changing.  So many people fucking crying with people taking profits after the events, which happens EVERY FUCKING TIME a company has a big event.  Price target upgrades, earnings, their other event later this month.  It's so fucking bullish on AMD right now.  NVDA sold off during their event in September, and what happened barely a day later?  Went up over $35 fucking dollars lol.  It's the retards playing weeklies that are crying.  Plain and simple",where my AMD bulls at,I'm not afraid of mango tweets anymore.  I'M NOT AFRAID ANYMORE!!!,On today's episode of emotional traders we feature the bear trap,"Yes hello I’d like to return these SPY calls, they’re malfunctioning",Just wait it out for a return to an uptrend.,HTZ to $3,"Please don’t ruin this, freedom people.",the last put I owned was when you retards thought tankers where going to store the planets oil for some reason.,The only thing consistent in October:,Amd fucked me,bull sad,"My broker just sent me an email asking if had an ""Exit Strategy"" ...I feel attacked.",I really need this to dip to at least 324...,"Fake and gay pump was in fact, fake and gay.","If you riot today please don't touch gamestop, I don't want to be bagholding any longer",NIO is a safe haven in this market,JPOW: We are BRRRing to keep bulls happy. We have a robust BRRR policy. Thank you.,Call me retarded but I see NIO being green by EOD,Jesus Christ I just wasted this whole pandemic. I'm never getting off the dollar menu,I woke up after 2 hours of sleep to my cat purring on me and kneading my stomach. So cute,Rip to BABA call holders me included 😭,"PLTR, be gentle, it's my first time",I put my rent money in NIO LI and XPEV. I got a mortgage in return
