143,SPY Missed earnings by 2 trillion stimulus,"Well boys, made enough this week to treat myself to a Big Mac.",stonk market 2020,need sum stability,https://twitter.com/DeItaOne/status/1313882521558487041,"Trump will crumple and go back to hospital.  Regeneron (it's what plants crave), will drill.",But you fellas are staring at charts every day and opening retarded positions daily. It's like they fired the gun to start the race and you started breakdancing,"I dunno why they chose today to change that rule, but seems kinda sus",7k of calls let’s get it baby 🍏🚀🍏🚀,Are we going back to levels not seen since Thursday or Friday of last week?,20% Physical Bank Branches,"Becky is SHOPPIN' at AMAZON, huge retail sales beat:",I regret every single decision I have made since last Monday.  Fuck.,Red by close.,https://twitter.com/DeItaone/status/1320715504215089158,Don't you hate it when you gotta take a massive shit but you don't wanna get out of bed and mom hasn't emptied your emergency bucket out yet,The state of our Information age.,That video of Elon saying you should take big risks if you don't have kids or a mortgage is either going to make me rich or broke. I love that shit.,,Futures fading,Tonight is the season finale of America,"Not a trump supporter or biden, im europoor i dont care about ur dumb 2 politics, but its seems that trump can make stonks go up better than joe and thats all i care","Note to self: instead of buying puts, use the money as a fire starter.",🚨IF YOU LOST A TON OF MONEY TODAY🚨,Damn cant believe Biden cured covid ina day! He is like a modern day Jesus! Lord of the tendies!,DUDE FUCK THIS FUCKING MARKET HOLY FUCK,OMG guys can you believe NIO is down 10% from ATH after being up 100% in a month. Time to PANIC!,"Even if we have lockdowns again, tech isn’t going to magically shoot back beyond ATHs. This isn’t like March where we didn’t know shit. We know a vaccine is coming and we know, while contagious, the virus isn’t deadly for the vast majority of the populous under 80.","Lose $600 on the stock market, don’t bat an eye. Spend $80 for a new jacket and regret it immediately."
144,Take the S&P sub 280 and see how fast that bill gets passed,Calls on McDonalds,Mango going crazy this morning,"There is literally a fake as fuck Russian troll farm article upvoted 150 times sitting on the front page of WSB. People are in there having debates about the ""death of the dollar"" even though a small skim read can see how fake and in broken English the article is.",Florida gonna Florida,Pelosi wearing a face mask with oranges on it trolling him lol,Is deepfuckingvalue going to get PRPL'd? Find out tonight at 6,IM A FUCKING INVESTING GENIUS,Apple 135. It’s happening,Anybody else just play like two tickers and just change the positions based on the market? I barely trade anything except aapl and amzn.,20% Brick and Mortar Retail,All those Great Depression 2 people are so dumb....,Looking forward to:,When Robinhood says Congratulations! for selling your FDs for a loss 🤡🤳,"JPMORGAN ANALYSTS SEE AN ""ORDERLY"" ELECTION VICTORY FOR DONALD TRUMP AS MOST FAVOURABLE OUTCOME FOR EQUITIES",AMD going back up,Maybe cause more people dislike Trump than Biden..crazy thought,Nancy is down to stimulus talks with just herself. It's going well though.,I'm seriously never looking at Futures again. What a waste of energy,"If this drops to .50% by open, it’s gonna be bloody",,"How the hell have elections been so close for so long? It’s always 49.999% vs 49.998%. It happens so often, how is this statically possible",Guys if you are not making money in the market just learn how to code,"It is just money. You are crazy enough to be here, so you’re crazy enough to make it back. Worst case, there’s bankruptcy. Debt wiped clean. Hell, my daddio was getting discover card offers only a few months into his bankruptcy. There is always hope.",IT IS TIME BULLS.  BUY EVERYTHING,5k -> +30k -> -25k,,You aren’t ahead of the curve.,"For all of you NIO haters, I made $10 on my trade today.  So there you go.  See, it only goes up."
145,Officially broke the 100k mark on my portfolio today.,Puts on making a living from this shit,Bears show up wearing the biggest masks I've ever seen.,Makes you wonder how many fake ass bot commenters are in the daily thread every day pushing hedge funds worthless tickers.,"Damn, GG Bulls! You did it!",Damn its ALREADY October we are 7 month’s into 15 days to slow the spread Wtf! Fuck Covid,Wonder how many people listened to that retard who said buy GME AH after a 40% day and 6% AH movement,Made more money on options in one day than in 4 years of investing.,One week ago everyone hated Apple lol,Does anyone else have the most stereotypical boomer parents? My dad who rails against “snowflake entitled lazy millennials” hates “ok boomer” because of how “disrespectful” it is. 😂,20% Linear TV,Get in pussies we’re making bulls great again,Pelosi saying stimulus is unlikely,,"Also remainder, JPMs price target for TSLA is $75",Diluted by 7bn.,See you autists at the soup kitchen,Pretty crazy how the economy just recovered at 12:30 today!,"If you BOUGHT THE DIP and are BIG SAD RIGHT NOW, don't trip out; it's just money. You can make it back. Call this # if you need someone to talk to. Don't make a permanent decision on a temporary situation.","Can we just free fall to 310 already , in one fucking candle please",If you ain't ready for 9:30 you ain't black,This is so predictable. Biden’s gonna edge it out at the end. Trump gonna start Tweeting stupid shit and contest it and were going to drill to earths core. Saying this holding calls btw.,When I’m old as fuck and my grandchildren ask me Pop how did you become rich? I’ll be like NIO calls baby during the worst pandemic in over 100 years bears r fuk,Don’t make a permanent decision over a temporary situation.,“A Biden win will crash the market” bears and Trump supporters are retarded 😂,how in the actual fuck...would've been better off just buying stocks since march lmao.  they ain't lying when first ones free.,EVERYONE BUY NIO KEEP THE FOMO TRAIN GOING,what a time to be alive. theres like one crash in stocks per month and one new bull market in stocks once a mont. the pace of these cycles is increasing .,I’m gonna sell NIO just so it pops off. You’re welcome guys
146,What a great day,can’t believe this is the one time i don’t have spy puts,I take experimental cocktails of drugs all the time and you don’t see me bragging about it,"I've been day trading since March, I'm down £6. What a cunting waste of time","You cured covid, stopped racial discrimination, passed the 2nd stimulus bill, saved Trump from Covid, reversed the recession.",Just keep flattening that curve. #neverforget,"why can't Amazon order updates tell you what the fuck you ordered in the email. it's so fucking annoying,. Thanks Amazon order# 410923812098423109 has shipped WHAT THE FUCK DID I BUY",Thank you NET,JESUS CHRIST APPLE STOP,Cardi B caused this,20% Freight Rail,Trading drunk is hard,White House saying they are upping the offer,Good morning Poor Boys,i miss getting shitfaced at nightclubs and failing to get girls at the same time,Only down 2.5bn,No lambo this year,That was a close one.,Today's my worst day ever. Down over 20k,Oh god im so fucked,Two requests:,I'm kicking myself for believing any bear bs at all.,Holly shit I just became lower middle class,.-.-.-.-.,"Me, down 10%: “I will sell as soon as I break even”",NIO straight line to 50 EOD,Baba announces oh yeah we did 300 billion in sales on singles day,"Welcome to Pre-market pajama trading, where everything is made up and the points don’t matter. That's right! Futures are just like the Patriots without Brady.",NIO ABOUT TO RIP TO NEW ATH FUCK YOU CITRON
147,❌ NOT SELLING A DAMN THING ❌,Fucking pussies selling... I thought Corona was no big deal to the Trumpers?! 😂,Made a quick $800 I’m done trading for today,How many people are scrolling on an iPhone right now?,I applaud you!,"You’re entitled to your own opinions, but you’re not entitled to your own facts 🥵🌶🔥",The next leg of WSB culling brought to you by GME,Spy trades flat for 2 seconds,"Made profit today, wasn't much but it was honest work. still down -74.54% all time","Everything has gone flat, and at some point the MMs will send a massive dildo of a random color and destroy half of us. And there's literally no way to know which color it will be.",20% Traditional Transportation,Bro it’s 9am,Mnuchin to talk to Pelosi,Officially down 10K all time let’s goooooooooooo,I’m a snap truther. Shit is worth actually $0,"Without XLNX acquisition, AMD would be up 4.5bn or 5%.","His calls are sweaty, longs weak, bags are heavy","For a second there it seemed like there was a third wave of the virus, the housing market was in a bubble, millions of people couldn’t afford their rent, etc.",I'm going to have water soup seasoned with salt and pepper tonight.,Haha we got retards in here playing options that ask what time we open,Don’t buy SPY puts.,Stupid 🏳️‍🌈🐻,"This ain't no rug pull, this is a magic carpet ride.","24/7 Crisis Hotline: 1-800-273-TALK (8255) (Veterans, press 1)","Me, eventually up .01%: “the market knows what it’s doing, let’s hear it out”",My nio DD was watching u kids make tendies and fomo-ing into it yesterday.,I think i really need to get into it now,NIO makin people rich out here,Lol these nio bulls got wiped the fuck out ignorant pricks
148,The year is 2050 SPY reaches an ath of 1500 on a .01% chance of a stimulus bill. Life is gud.,Events in the US Today (EDT):,Cuomo literally said the word bullish. Calls on everything,Donnie has to go. Vote his ass out,Market falls on doubt of stimulus...,Premarket AMD is gonna make me climax,I pulled the trigger on an AMZN 3200 call for earnings yesterday. 10.4k most expensive option I’ve ever bought. Let’s gooo,WSB: Puts?,This place has way too many incel nerds and not enough chads. If youre not a chad dont fucking respond to this because I dont give a shit about whatever opinion youre going to emit in a high pitched whine here.,I fucking hate shit like this. Absolutely no way to make rational moves right now.,none of this bad news is enough to strain the backbone of the american economy,"To the guy who reccomended shorting Amzn, fuck you",Renewed optimism around stimulus,On November 3rd Trump wins a victory and takes his mask off. It was Vince McMahon all along. He kidnapped Donald Trump and took his place to become the president just to piss off Stone Cold Steve Austin and this has been his plan all along since 1997.,Senate cares more about filling an empty seat than filling the wallets of the American people 🤡,Buy the dip.,Gone is his deposit already,Glad that’s all over though!,Like if you lost money in October😅,Now that you all have abandoned your puts...,,"Missed job numbers, unclear election results, POTUS attempting to overthrow democracy.",Before or after Joe wins: do we buy now or Biden?,Crisis Text Line: Text TALK to 741-741,"Lol the Trump admin tried to take credit for the Pfizer vaccine, then Pfizer was like ""nah""",Since then I’ve done further dd by reading a thousand nerds cry “buy the dip” and have done so.,Events in the US Today (EDT):,"im gonna be honest, NIO gang might be the worst gang ever created here lmao",Guys don’t sell NIO it will bounce back in a few years 🤡🤡🤡
149,AAPL $120 EOD🍏🍏🍏🍏,DAY - Wear a mask & socially distance <3,The worst part about wearing a mask is smelling my cock breath,3.3k to 670$ 😎,A little later,1.5 million in this sub and only 7k online now... it's a disgrace,i can see chunk of 5 million shares of GME purchased in one go. This shit gonna surely explode.,Imagine not going balls deep into AAPL at Friday close...,‘’Markets rise 47% after the DAL miss demonstrates renewed need for stimulus’’,"My prayers to Papa Elon were answered. I made more today than I've ever made in a week at a job. I sold enough to withdraw my gains, and I'm sending it to one of my old army buddies who's lost his job and house and living in a hotel with his family. Life is fucking beautiful sometimes.",exercise bikes with ipads on them,"Imagine how much better this community would be if people actually brought in information to share, rather than 1,000 retards asking retarded questions to eachother like ""Why stock go down today?"" ""My stock go up tomorrow?""",Red to green,,Down $50K. This is fine.,INTC revenue down 4% vs AMD up 56%,BULL SPAGHETTI,I'd be taking profits right now...if I had profit to take.,Broke my personal record of being down 10% before 10AM.,we’re about to fall of a cliff,Maybe the real election winners are the friends we made along the way,Market: I wanna go fast and turn left,FIX YOUR POSTURE BRO. YOURE LOOKING LIKE THE DAMN HUNCHBACK OF NOTRE DAME,Veterans Crisis Line: Send a text to 838255,https://www.independent.co.uk/news/world/americas/us-election-2020/mike-pence-covid-vaacine-pfizer-b1719698.html,It’s okay NIO you moon when you feel like it,DAY - US Bond markets are closed for Veteran's Day,And i've been apart of A LOT of gangs,I am going to shit on citrons porch tonight
150,If Trump wants to win the election here what he should do.,8:30am - Unemployment Rate (Sep) [3/3 Volatility],There’s still time to delete this.,There is no way that dump is the end of it right? No stimulus until November at the very earliest and vaccine guidelines just got stricter is not very bullish news.,Market climbs on hope of stimulus,It’s 7 am on the east coast you retard,Gamestop is my favorite casino,Anyone else low key terrified?,robinhood: YOUR PORTFOLIO IS NOT AS DIVERSIFIED AS YOU THINK!,After trading aggressively for 2 weeks with $25k I have made $3.00 😎,CNN Business has a NIO median forecast of $135.47 and a high forecast of $269.54 a year out LOL 🚀🚀🚀,Just got a call from the IRS. Crazy that they accept apple gift cards now. Glad I got that taken care of,We are being played by boomers like clockwork.,,CUT MY LIFE INTO PIECES,INTC op income down 22% vs AMD up 119%.,😍😍😍,BULLSSSSSSSSSS I SEE YOU SHAKING,I’m down 19% before 9:40,You had the audacity and good luck to buy the March dip.,Imagine ruining your career for the mango and he calls you by the wrong name 😂 “Lil pimp”,"This is not good for my mental health! At a loss or at a profit, I’ve become consumed by the ticker. I’ve gone days feeling nothing but anxiety. I miss working out and smoking weeks without thinking about my money dissaapeaing or becoming rich. I’m taking a break guys see you retards later",Is it true that NIO's CEO is named Eron Musk?,SAMHSA Treatment Referral Hotline (Substance Abuse) 1-800-662-HELP (4357),Poor mango taking endless L's this week.,"Call me Isaac Newton, cause my prosperity is dependent on AAPL falling","If you are a veteran or active military first, I love you and want you to know you are cared for.  If you need someone to talk to message me or someone you love. :)",You dumbass rh users really gonna make nio $50 tomorrow,I really blew up my account with PLTR earnings fml.
151,Screw the Pelosi stimulus instead Give everyone 5k credit in RH which they have to use or it gets taken away. Which will get us to  SPY to 400 by Nov.,Nonfarm Payrolls (Sep) [3/3 Volatility],SPY starts to drop and then an order for 6 shares comes in and moves the price up 20 cents.,All 🥭 had to do is pass massive stimulus and he would have won easily,Kang gang in the bounce house,I cant believe what a fucking loser I am for selling my PTON 90c 10/16,GME 1 min chart look like the battle of thermopylae,"Jesus these bulls are powerful, out here sweatin with my puts","ME WITH 100% TACO, DENNYS, AND WEED OPTIONS: YEAH I KNOW, THAT'S THE POINT BOOMER!",LOL FSLY REKT,"This girl from high school has an onlyfans for $25, and while I never thought I’d pay for some stupid shit like that, i’m seriously considering doing it because I’m very curious about what that Pussy looks like lol",Looks like it's beans for dinner again 😞,Still a better saga than TikTok,"YOU CAN SHOVE IT UP YOUR ASS, ALONG WITH MY FUCKING CALLS",THIS IS MY LAST EARNINGS REPORT,ZEN 3 will be released soon and benchmarks all favor AMD.,"how's the ""best trading day of the year"" treating yall","MAJOR CRASH AFTER HOURS, YOUR CALLS WILL OPEN AT -95% TOMORROW",Fuck you AAPL. Just fuck you so much.,"You, like almost everyone else, made a fortune trading the big tech stocks. Among those you find your favorite race horse. You win almost every bet on this stock, and buying the dip always works.",Is AMD competing with Elon's Boring company next?,"Made 57 dollars off one nio option, enough risk for today","Elevator up, stairs down.",The National Problem Gambling Helpline (1-800-522-4700),Stay strong NIO bulls. This is our week to shine. Go fuck yourself bears for life,,DAY - Wear a mask & socially distance <3,LETS GO NIO 🚀🚀🚀,So now both XPEV and LI reports great Q3 earnings and moons. Any reason we shouldn’t yolo in 11/20 NIO calls for their Tuesday earnings?
152,Trump jr I know your trolling here go tell that to your dad.,Average Hourly Earnings (MoM&YoY-Sep) [2/3 Volatility],https://imgur.com/gallery/kkRt1bj,I genuinely feel bad for anyone who lost money and got blindsided by Mango in Chief.,Imagine buying calls yesterday then switching to puts at the bottom in the afternoon and losing money both ways,Fuck it. This gay bear is going into hibernation. Just covered myself in hamburger meat and have been mooing around the house on all fours. Ready to make money with the bulls.,"GME Discussion Thread for October 9, 2020",Learn to take profits. I’m not making that mistake again.,Hilarious when the big banks issue downgrades to their competitors. JPM downgrades Citi to Neutral,CEO BLAMING COVID FOR LESS REVENUE FOR A CLOUD COMPANY WHEN CLOUD IS FUCKING BOOMING BECAUSE OF COVID THEY DONT KNOW WHAT THEYRE DOING LMAOOOOO,"If you buy puts at open today, you may be retarded.",AAPL you ignorant slut - I didn’t stretch my dick all day for you to reverse moon on the 5 and 15 min candles 😡😡😡,"If these stimulus talks have convinced me of anything, it's that the US political system is full of useless degenerates and people looking to make a buck. That has obviously been true forever, but twitter/social media really brings it to the forefront.",I'm not a fan of Pelosi but there are more retards here than I thought.,"hol up, why does the market care so much about a deal between munchkin and pelosi anyway when mcturtle will kill any relief bill that isn't his?",AMD released earnings already?,"UPS beat earnings by 23%, damn",IM COMING TO POUND YOUR PUCCI IN 15 MINUTES,Sent from my iPhone.,"One day the market suffers a correction and your positions take a hit. ""I'm long term positive on this company, I'll buy the dip and wait"" You say.",It's fucking been only drilling for last 10 days,"Finally got to under $100 today, fuck yeah. Just throw me off the bridge, I don't even care anymore. 🎃",Fuck you Mr.Market. I needed this big dick rally last month,The National Problem Gambling Text Helpline 800-522-4700,Biggest green day since forever and you are somehow losing money? Are you me because FUCK,"Thanks, I'll see myself out",6:00am - OPEC Monthly Report [2/3 Volatility],BABA is a bigger disappointment than my firstborn child,"Game plan: Be patience at open, if Nio dip 30 on RSI buy three calls for Nov 20, take profit on Monday."
153,STAND BACK AND STAND BY BULLS,Participation Rate (Sep) [2/3 Volatility],Live feed right outside Donnie’s hospital.,Especially when last week he specifically said he wanted congress to come up with a stimulus and work hard at it.,"Id like to thank this sub for essentially bankrupting me. Yesterday I bought all puts and now I am broken. I'm out for good, taking my money and never coming back.",I WILL NOT FOMO INTO SOLAR. I WILL NOT FOMO INTO SOLAR. I WILL NOT FOMO INTO SOLAR.,Everything is too high. Can we get a COVID-20 announcement or something so I can get a better entry point?,"Up almost 10k today, holy fuck I’m a savant. Forget all those other losses - today I am financial God.",https://i.redd.it/bekphnqftcb41.jpg,"Goldman about to report earnings, BAC was terrible, if Goldman misses too then today is bloodbath",Do not fucking open calls at 9:30-10:30.,Lost $500 a day for 3 straight days holding out hope for my weeklies which are now worth 0.01 🤡🤡🤡,Pelosi counts her change at the gas station with a line of people behind her,"McConnell and his goons are up for reelection soon. They don't want another bailout attached to their name when they're running as ""conservatives"".","Do you ever get boned by options and think about the rich cocksucker who probably sold it to you? He probably turns on his phone for 15 minutes a day, sells some shit to us retards, turns off his phone, gets out of his lap pool with his super model girlfriend, and then walks to his garage to go get into one of his 7 lambos.",https://ir.amd.com/news-events/press-releases/detail/976/amd-reports-third-quarter-2020-financial-results,Lmao I always fucking pick the wrong direction,I love farting in the middle of the night. It feels amazing,"I can't explain why but I feel so much better losing money with a ton of people that I don't know.  If I was by myself, I'd probably feel bad.","The day after that you wake up and it's a sea of red. Your favorites are declining over 3%. You say to yourself ""Now is the time to go in"". The stock keeps declining intraday, but you keep buying the dip, not realizing the huge position size you're building up.","I think it was funny but got no love yesterday, so i'll just post it again. Downvote if good. Upvote if very good",I was told there would be a civil war wtf,"Woah another 2% days?????? Nice, I like this new POTUS!!!!!!",red cause people taking profits for the weekend,Fucking dogshit tech getting creamed by vaccine,Probably shouldn't have played with my tuition money. FUCK,7:00am - MBA Mortgage Data [1/3 Volatility],Alright fine I'll buy stupid NIO,Whoever did the DD on Nio like 4 months ago...you are a godsend.  I will find your post and print it out and frame it.
154,"Fellas I took a girl home and she saw my Ratatouille bedspread, what the fuck do I do",9:00am - FOMC Member Harker Speaks [2/3 Volatility],What the fuck is happening.,"Markets should moon when mango goes away. No tariffs, big stimulus with tons of free money, covid plans etc etc",Trump is tweeting about a fuckin Coup and the market is just slowly trickling up.... straight clown world,PLTR cofounder seems like a douchebag. Might buy calls,GME to $20 or $10 you heard it here first,Child labor is the best,so sick of these new retards screaming DUMP every 2 seconds.,"Welcome to Pre-market pajama trading, where everything is made up and the points don’t matter. That's right! Futures are just like the advice you got from your high school's guidance counselor.",The amount of selling is going to be strong. Go fap and come back with a clear head and don't try to catch falling knives.,Futures flatter than a corn field under communism.,JP Morgan raises TSLA price target from $75 to $80.,Pelosi is holding out for Biden to get in so she can get a bigger bailout package.,Trump crushing his adderall right now about to let the power of science dictate world resolution,,Statistically best trading day of the year 🤡,It’s funny how everyone online makes at least 100k if you ask their income.  You can’t all be plumbers.,"If you ain’t got a job, and you ain’t smokin weed, then I dunno what the fuck u be doin","The next day the correction continues. You've wiped out your initial gains and some more. You have no cash to buy any more dips. When the bell rings, your portfolio is utterly broken and so is your spirit.",Upvote if you've made money today 🚀🚀,Alright alright alright everyone come clean: who bought NIO at the top?,NIO $40+ today,Everyone here is talking about nio. I am gonna sell half of my position .,"Just dumped $500K into APHA. Wish me luck. It's better than ACB, overlooked, and is simply lagging behind ACB. If ACB reports strong earnings, expect a huge gain across the entire sector.","Just woke up and checked CRSR. Looking good. Looking good. Just shatter earnings please and go up to a $100? Maybe $200? Heck, make it $1000, I won’t complain.",9:30am - Seevol Cushing Oil Storage Report [2/3 Volatility],Holy fuck if you don’t have NIO calls this market is boring.,When you're doing arts and crafts with your kids and the scissors start to glide is what i imagine heroine must feel like
