72,6:00am - Euro Zone EU Leaders Summit [3/3 Volatility],You guys had no idea how hard it was to find this out at 1 AM and have no one to tell because everyone was asleep,3:50am - France Services PMI (Sep) [2/3 Volatility],Really don’t understand how FedEx is faring any better than UPS. We ship packages all the time and UPS never misses the mark. FedEx is easily under 50% on their commitment time since corona. And a lot of the delays are employee error not just “backed up due to corona.” Moral of story: fuk FedEx.,10:00am - Canada Ivey PMI (Sep) [3/3 Volatility],"Yes, if the roles were reversed and that self-absorbed fuck had the option between my life or pumping the market he wouldn't hesitate to pull the plug on my oxygen tank.","If you have nobody, message me. I'm happy to talk to you.  I care about what's going on in your life.  Your problems matter. :)",7:01pm - UK BRC Retail Sales Monitor (YoY-Sep) [2/3 Volatility],iT’S PrIcEd In,"United Airlines, Alcoa, Sleep Number, Accolade, Crystal Clean",FOMC Members Kaplan & Quarles Speak [2/3 Volatility],"I don’t know about today. Futures are green so the market should be red during trading hours. Also WSB is quite bullish, which implies buying puts.",|. \,"The preliminary Eurozone PMI fell below the 50 level that separates growth from contraction, sliding to 49.4 from 50.4 in September. That was a whisker above consensus forecasts for 49.3.","I accidentally bought SAP puts instead of SNAP puts and let me tell you, I’m not complaining!!!!!","Hurricane Zeta is due to make U.S. landfall on Wednesday, with rigs and refineries shutting down in preparation for its arrival, while traders also await crude oil supply data from the American Petroleum Institute, due later in the session.",8:30pm - Australia NAB Quarterly Business Confidence [2/3 Volatility],Anyways what are some good calls that expire this Friday? My boss just gave me a bonus and I need to turn it into 10k and all I need is a 500% gain,I outperformed SPY today.,Nio marketcap 41.66bn,New Zealand Unemployment Rate (Q3) [2/3 Volatility],"JPow: ""No, I am the bull king.""","Weekly unemployment still higher than any period of the Great Recession, while we are 8 months out from the start","Just got out of my ACB March 2021 20Cs. 25 baggers. Bought at .08, sold at 2.20. Crazy.",market rally,Anyone need lessons in how to be a fuckin loser?,NIO diamond hands gang,10:30am - Euro Zone ECB's Schnabel Speaks [2/3 Volatility],I will never NOT listen to it
73,6:20am - UK BoE MPC Member Haldane Speaks [2/3 Volatility],The one time I swing calls I’m about to lose 10k. Gonna have to start selling crack again fml,3:55am - Germany Services PMI (Sep) [2/3 Volatility],You know the FedEx guy that comes to your house or office doesn’t work for FedEx but is an independent contractor or hired by an independent contractor- you can actually buy a FedEx route and show them how it’s done -  ups is all corporate employees,5:00pm - New Zealand NZIER Business Confidence (Q3) [2/3 Volatility],"Breaking news: RKT teams up with Travis Scott to offer fans his favorite 30 yr fixed rate mortgage product, with bacon and a sprite.",FOR IMMEDIATE RELEASE:,"In the United Kingdom, new outbreaks of the coronavirus are at a tipping point. Prime Minister Boris Johnson is expected to announce a new three-tier local lockdown system for England today, which could temporarily close pubs and restaurants in the virus hot spots.",If everything is priced in just close the market you idiots.,Earnings This Week,5:00pm - Sec Kashkari Speaks [3/3 Volatility],"I should therefore buy puts. However, I also learned I should always do the opposite of what I think is right, so spy calls it is. DD done, let’s goooo",8=👊===D💦,Earnings Before Open:,I... lost.. everything...,Events in the World Today (EDT):,10:30pm - Japan BoJ Interest Rate Decision [2/3 Volatility],,Spy is down like 1.5% and I'm down 8%😎,"Delivered cars total 63,343",6:50pm - Japan BoJ Monetary Policy Statement [3/3 Volatility],Biden: OMAE WA MOU SHINDERU,"No PPP, Unemployment Benefits since mid summer",A few hillbillies in Kentucky decided the fate of the stimulus for the whole country smh,Is god finally sending us a sign that the 2020 nightmare is ending?,Can we set every stock price to $0 and start over?,Imagine holding weed stocks longer than 5 hours,11:00am - UK BoE Deputy Gov. Woods Speaks [2/3 Volatility],imagination: most people on this sub are successful chad investors who drive teslas and live in downtown penthouses
74,8:30am - Canada Building Permits (MoM-Aug) [2/3 Volatility],"If he dies, he dies.",4:00am - Euro Zone Markit Composite & Services PMI (Sep) [2/3 Volatility],"CEO of NVIDIA just said there's gonna be a supply shortage of NVIDIA graphics cards into 2021. This will push a large chunk of the entire market to crossover to the new AMD graphics cards, which are proving to be competitive in terms of quality, performance, and price. And the new AMD processors are curb stomping Intel on all metrics.",7:01pm - UK RICS House Price Balance (Sep) [2/3 Volatility],For the put holders still around,"(AP) Washington D.C. - Speaker Pelosi and Majority Leader McConnell have agreed in principle to a second round of stimulus. In the proposed standalone legislation, every American will receive an additional $1200 one time payment, as well as an additional $600 per month for the next 12 months. Sources close to the situation confirm additional assistance for beleaguered airlines is being discussed in a separate bill. The total anticipated cost for this bill is $4 trillion. When asked for comment, Speaker Pelosi replied, “Fuck your puts.”","British Airways Chairman and CEO Alex Cruz will step down as the airline’s chief executive, parent firm IAG announced on Monday.","Quick story time: I’m missing my right arm due to a car crash when I was young. When I was in high school, I had the opportunity to be a Senate Page, which meant that I got to work on the floor of the Senate.","I don't use Apple products, but did they just announce that they're going to sell a 1k phone with no charger at the event?",8:00pm - Presidential Candidate Town Hall Live Streams,So a little undercover DD here.,|. .                     💦,American Express,"Not your friends. We’re still here, buddy. You’ll be alright",7:00am - France Jobseekers Total [2/3 Volatility],EOD - Japan BoJ Outlook Report (YoY) [3/3 Volatility],It's dumping fast,Just think...by this time next week we will know who won the election and bear witness to a completly 100% peaceful uncontested transfer of power with no issues whatsoever as the market moons 15% in a week because America is so strong it beat COVID19.,"So roughly 650,000$ / delivered car",Banks including BNP Paribas SA advanced after joining its European peers in posting lower-than-expected bad-loan provisions from the pandemic. Most of Asia’s biggest equity markets jumped by more than 1.4%.,Bulls: They had us in the first half not gonna lie,Banks sitting on a ton of mortgage loans about to default,Hmm take 0.78% gain or wait til 20% loss,Oh look. PfiZer announces vaccine 90% effective week after Biden was elected. Predictable.,Why do I have 9 followers on reddit? Like who the fuck follows ppl on reddit?,BABA GREEN SUCK MY DICK CCP.,UK BoE MPC Member Cunliffe Speaks [2/3 Volatility],reality: most likely 18-25 year old college fukboys YOLO'ing their college savings
75,11:45am - Euro Zone ECB's Lane Speaks [2/3 Volatility],Sometimes boomers gotta die at work to save the economy.,4:30am - UK Composite & Services PMI (Sep) [3/3 Volatility],Can't wait for the official AMD processor reveal on Thursday and their graphics cards reveal in a couple of weeks  🌕 🚀,7:50pm - Japan Current Account n.s.a. (Aug) [2/3 Volatility],"howdy, im the sheriff of sadness",Edit: my god y’all are some dense mother fuckers. Lead could take a lesson.,Earnings Before Open:,"The best thing that ever happened there was an interaction I had with Senator Inouye of Hawaii. Now, you need to know that we were under strict orders never to bother Senators unless they spoke to us first. So we were all meek and sheepish around them.",They will provide the cable but not wall adapter,Treasury Secretary Steven Mnuchin said on Wednesday that reaching a coronavirus stimulus deal before the election would be difficult as Democrats and Republicans remain far apart on certain issues.,"Vaccine is going to be used on US military end of November, beginning of December and rolled out to the civilian population from there. They were briefed yesterday afternoon. Straight from DHA.",|. .                              💦,"Sad knowing that, even if we manage to end today green, I’ll still be down a metric fuck ton for the week.",I have massive hangover guilt because I got blackout dronk and ruined about four relationships I had with people.,8:30pm - Australia CPI (QoQ-Q3) [3/3 Volatility],Japan BoJ Monetary Policy Statement [3/3 Volatility],The people on WSB’s before 7:30 EST are the real OG’s,Good shit!!!!!!,We are all salty about not being on the train,Oil held gains after jumping the most in three weeks on Monday on increasing signs OPEC+ will delay a planned easing of output cuts.,This divided nation is the result of federal + state funding cuts to our education. Y'all a bunch of Trumpkins,Commercial real-estate about to bust,NIO to levels unseen since yesterday,Told my friend at work to buy an ACB call on Friday before close and he’s flipping his shit rn,BABA black sheep have you any gains?,9AM LETS HAVE A GREAT DAY EVERYONE,11:45am - Euro Zone ECB Pres. Lagarde Speaks [3/3 Volatility],"I bought NIO at 52 but it’s ok cause we’re headed to 60 boys, just refueling for the launch"
76,7:30pm - Japan Jobs/Applications Ratio (Aug) [2/3 Volatility],If spy has a -5% day I will go on the biggest fucking gold awarding spree,UK BoE MPC Member Haldane Speaks [2/3 Volatility],"Come on baby, Daddy needs to make 25000 dollars so I can daytrade at Charles Schwab instead of Robinhood.","German industrial production, the heart of the Eurozone economy, surprisingly fell 0.2% in August, defying hopes for a 1.5% increase. The numbers are best viewed together with factory orders data, which exceeded expectations on Monday.  Spain’s industrial production drop eased, meanwhile.",,Gotta start selling crack again smh,None,"Anyway, my best memory was sitting at the rostrum on the Senate floor, and Senator Inouye flagged me over.",My girlfriend just brought up how when we get married and join finances I’ll be able to invest some of her income 🤡🤡🤡🤡🤡🤡🤡,"His comments came after House Speaker Nancy Pelosi, D-Calif., said earlier this week that a recently proposed package by the administration “falls significantly short” of what is needed.","That’s about all I can share, but the Pfizer news is probably legit...not your weekly vaccine pump.",👟👟                            🐻,here’s hoping though,RIP,"Europe has been hard hit by this second wave of the virus, with France, for example, on Monday seeing the highest number of coronavirus patients going into hospital since April. Several countries have now imposed new restrictions--Spain declaring a state of emergency for six months--curtailing economic activity.","The Stoxx Europe 600 Index sank more than 2% after German Chancellor Angela Merkel proposed closing bars and restaurants for a month to curb the spread of the virus. The selloff across Europe was broad, with auto and construction shares seeing the steepest declines.",,If I put my company's zoom meeting info/pass how many of you fine fellows would like to offer some morning market advice to my least favorite people in the world 🌝,They don’t even have their own factories lol,"Less than a day after Prime Minister Boris Johnson announced a month-long lockdown for England, one of his top ministers and closest allies signaled the measures might have to be extended if they fail to contain the spread of the coronavirus.",Asparagus,"Elections, regardless of being contested or not, solved nothing of the above, especially if Senate didn't flip",PLTR JUST PAID OFF MY CAR. Thank you beautiful autist for the DD,He thinks you’re a god now. See if he’ll suck your dick,"No sir, no sir, just empty bags",NIO looking to 🚀,1:00pm - Germany Buba Mauderer Speaks [2/3 Volatility],Imagine explaining to your wife that you lost everything on a Chinese car company
77,9:30pm - Australia Retail Sales (MoM-Aug) [3/3 Volatility],I can picture the next two weeks: dumping or pumping on rumors of the president’s recovery status. I’m opting out of this shit,5:00am - Euro Zone Retail Sales (MoM-Aug) [2/3 Volatility],I need a AAPL pump today,Earnings Before Open:,Come on apple 🍏 you can do it.,"Put your money in ARKK and ARKG, walk away, come back later to more money. Cathie Wood is the truth",Earnings After Close:,"I rushed up to him, thinking he needed something, and he says, “you know how your arm still feels like it’s there?”",RIP her credit,The House is officially out of session in Washington until after the election.,"My brothers, I hope you had a good week.  Please detach from the market for the weekend.",FOR OLD TIMES SAKE,I’m a businessman doing business is the meme of the year,Tf did you do,"This increases expectations of action by the European Central Bank when its governing council meets on Thursday, although the consensus view is that the bank will only announce fresh stimulus at its December meeting.","The Chinese Communist Party’s Central Committee holds its plenum through Friday, where it’s expected to chart the course for the economy’s development for the next 15 years.",Just shave it all dude.,"His calls are sweaty, longs weak, bags are heavy",This can’t be real,"The Reserve Bank of Australia reminded world markets that central banks haven’t run out of ammunition quite yet, cutting its key rate to 0.10% from 0.25%. The RBA also announced its first-ever quantitative easing program, with an overall size of A$100 billion.  The decisions were in line with expectation.",FLIP FLIP FLIPADELPHIA,,I feel like NIO is everyone's second chance at TSLA,AMC found a vaccine wow,Pence going on vacation instead of helping trump with election lol he’s like fuck you mango you’re on your own,"I profited, if you don't count the fraudulent, illegal losses.",1:30pm - Canada BoC Gov COuncil Member Wilkins Speaks [2/3 Volatility],Nio-Nazis in shambles
78,The pound tumbled after a report that Brexit talks were failing to close differences on a trade deal and the European Union planned legal action against the U.K.,Does hope hicks have onlyfans?,6:00am - Euro Zone Eurogroup Meetings [2/3 Volatility],Got you covered pal,"RPM, Lamb Weston",Right now is the oldest you’ve ever been & the youngest you’ll ever be again.,I made a G today,None,“Yes senator”,Babe this is a casino,Events in the World Today (EDT):,"If you are depressed, sad, have PTSD, lonely, or worse, take the weekend to talk to someone about that.  You can get out of that rut, I promise.  Your problems are worth other people's time.",[69 420] it's your boy chimpu back with daily updates and insights,I found a truck stop hooker that looks exactly like Janet Yellen and she spent the entire hour lecturing me about fed rates. Didn't even have sex but I think I'm in love,Fuck Apple i hate all fruit now,"Data showed profits at China's industrial firms rose at a slower pace in September, hurt by factory-gate deflation and rising raw materials costs.",Earnings Before Open:,What happened to the bulls that jerked off here to +1% futures all night?,Gone is his deposit already,For the retards who thought it was 9:30 you should lose money just for that,"Indonesia's assumed entry into its first economic recession since the 1998 Asian financial crisis will probably be confirmed by third quarter gross domestic product data (GDP) being released later this week, a Reuters poll showed on Tuesday.",The real president is the friends we made along the way.,Looks around,This is going to open green isn't it,BULLS THIS IS THE DAY WE KILL EVERY LAST BEAR ON EARTH.  LOCK AND LOAD.,"Even he is like whatever man, fuck it.  I'll just write a book and make money",these daily threads have devolved into,2:00pm - Mexico Interest Rate Decision (Nov) [2/3 Volatility],robinhood is just fantasy football with businesses
79,"Negotiators are due to discuss state aid later Thursday, after Britain submitted a new round of proposals on how its rules will work after Brexit.",I would go insane as a bear. Everything points to you being right and should dump. Yet everything doesn't follow logic and goes up. How many times can you be right but wrong?,7:25am - Brazil BCB Focus Market Readout [2/3 Volatility],"Lemme tell you something gettin laid off was probably the best thing that ever happened to me, I get to sit here, trade stocks, play video games, and collect unemployment. Me n’ Lucy even got back together so that’s fuckin awesome. Yup, life’s the way you bake it.",Earnings After Close:,if sleepy joe wins we will rally on a 2.2 trillion stimulus,But you made it in a sleazy  way,Earnings This Week,"“That feeling never goes away, your arm just feels shorter as you get older. I’m old now and it feels like my hand is right here.” He motioned to the end of his stump.",I'm starting to think that some of you folks don't even know what a hammer toe kick flip samurai doji candlestick pattern is. Pshh. Stonks gonna go up.,12:30am - Japan Tertiary Industry Activity Index (MoM) [2/3 Volatility],"If you need someone to talk to, just message me.  I am happy to talk to you about what is going on :)",,Leveraged Lot Lizard,Holy shit SAP down 20% bruh moment,Earnings Before Open:,"UPS, Boeing, GE, Mastercard, Sony, Anthem, Six Flags, Dynatrace, Generac, Yandex",Blew our loads a little too early but I ate an avocado and an egg I think I got another load in me,BULL SPAGHETTI,"I'm not asking for much, just a 3 percent down day... 📉📉📉",Earnings Before Open:,"Bidens only fans leaked, snap up 2.31%",WOOOOOOOOOOOOOOOOOOOOOOOOOOOOOOOOOOOOOOOOOOOOOOOOOOOOOOOOOOOOOOOOOOOOOOOOOOOOOOOOOOOOOOOOOOOOOOOOOOOOOOOOOOOOOOOOOOOOOOOOOOOOOOOOOOOOOOOOOOOOOOOOOOOOOOOOOOOOOOOOOOOOOOO WHO WANTS SHOTS????,yup,As Warren Buffet once said:,Be GreEdY whEn OthErs aRe FeaRFuL,Look at MRNA,4:30pm - New Zealand Business NZ PMI (Oct) [2/3 Volatility],The saltiness over people not playing NIO is funny as fuck. The volume has been in the hundreds of millions all week and your bitchy ass spent more time bitching about the “spam” instead of buying a single call. Yea I’m glad the EV talk dominated the daily thread because it made me a months salary instead of playing any other boomer or tech shit that’s done nothing.
80,Earnings Before Open:,This market was voted most likely to be fake and gay in high school,8:00am - Germany Buba President Weidmann Speaks [2/3 Volatility],"Options trading is just a grown man game of hot potato.  I don't actually want any of my positions I just want to send the hot potato off to some other guy to deal with, hopefully he pays me more for it than I did","Saratoga, EXFO, RGP","if the mango wins we will rally on another 4 years of the president literally not giving a shit about anything but stocks, and spending all his time pumping them",Sellin’ puts to the kids,God fucking dammit,"Before I could respond, Senator Dorgan from my state walks up and says, “what are you boys talking about?” And Dan Inouye looks at him as serious as can be and says, “It’s a one arm thing, you wouldn’t understand.”","Smh, just follow the fettucini levels nigga",2:30am - Switzerland PPI (MoM-Sep) [2/3 Volatility],Feds pumped another $77 billion. We moonin boys buy up at open,,So we gonna pull the whole green during premarket to dump immediately at open.. 😐,Those honest Germans. Wait till the truth catches up with the rest of Tech 📉,"Pfizer, 3M, CAT, Lilly, Raytheon, Sherwin Williams, Novartis, jetBlue, Merck, BP",Earnings After Close:,I love reading all of these random predictions as if anyone ever post any real reasoning,,Bears: The virus is raging.,"Wayfair, Humana, BauschHealth, McKesson, Ferrari, calent, AGCO, Sysco, TopBuild",Just emailed my boss. I refuse to work until the election is decided,who checks the portfolio every 2 mins,NIO doubt comments are more annoying than NIO shill comments.,"When others are greedy, FOMO into NIO at ATHs",That shit has me down another 20%. I should have been a scared ass lil bitch. At least I’d have some money.,RKT ruined my life,"European Central Bank President Christine Lagarde, Governor Andrew Bailey and Federal Reserve Chairman Jerome Powell are among the speakers Thursday at an online ECB Forum entitled “Central Banks in a Shifting World.”",Anyway. NIO 60 EOD.
81,"Pepsico, Bed bath & Beyond, Conagra, ContseNation",Maybe if he didn’t take the test he wouldn’t have tested positive,5:00pm - New Zealand NZIER Business Confidence (Q3) [2/3 Volatility],"-If stimmy passes, it's bullish because they will stimulate the economy.",Earnings This Week,win-win,I gotta get paid,https://twitter.com/realDonaldTrump/status/1315639802084110336?s=19,"Dorgan was speechless and just sort of wandered away. Inouye is still my hero for that. Just remember, if you ever do become rich and powerful, treating those around you with humanity can be life changing to them.",Sold my NIO calls yesterday for a loss AMA,2:45am - France CPI & HICP (MoM-Sep) [2/3 Volatility],I want to eat Karen’s ass for shopping so much.,,That appears to be the play,PTON and SNAP are the rock solid foundations of this economy,Earnings After Close:,"Fastly, Pinterest, Etsy, Gilead, Teladoc, Visa, Ford, eBay, Livongo, ServiceNow","Bullish at night, bears delight",,Bulls: Priced in baby.,Earnings After Close:,Market: is volatile,jpow: “were still in a recession”,,TRUMP PUMP,"RKT will absolutely crush earnings, raise guidance, and it’ll be -10% tomorrow",omg DKNG mooning,"Bitc0in breaks above $16,000 for the first time since January 2018",Y’all just ever sit there and admire your accounts net worth before you know shits gonna hit the fan at 9:30 and It’s gonna be a rough day?
82,Earnings After Close:,Invest in safe haven stonks like NKLA,7:00pm - South Korea CPI (YoY-Sep) [2/3 Volatility],"-If stimmy fails, it's bullish because national debt won't rise.",Imagine panic selling your positions because an obese mango man yeeted out a tweet under drug influence 😂😂😂😳 oh wait that’s me,I say “keep the change” purely for my own convenience.,The guy who rants for hours every day outside my apartment says that mango is definitely going to win. I'll ask him about airline stim later.,17 year old me blasting Up Up and Away by Kid Cudi before High school,"I didn’t ever want to be an amputee, but with just a few words, Senator Daniel Inouye initiated me into an exclusive club and I’ll never be able to thank him for that small act of kindness.",Do you have to wear your helmet inside too or just when you're outside?,4:30am - UK BoE Credit Conditions Survey [2/3 Volatility],RH doesnt have NIO 100c listed as an option. How can I make tendies if they won’t list the option i want to buy?,,"Daaaaamn. Just looked at the schedule didn't realize MSFT, AMZN, AAPL, FB, and GOOG all report next Thurs.",I just dumped my girlfriend and honestly did not expect to feel this happy/relieved.. should've done this sooner,"Microsoft, AMD, FireEye, First Solar, Enphase, Akamai, Fiserv, 2U",Earnings This Week,ok when is this bull trap happening my puts are bleeding,Is the retard who said he gonna chop and eat his own dick being held accountable?,Bears: Riots in the streets.,"GW, Prudential, S2Gold",VIX: aight imma head out,spy: “bruh i literally can’t hear you”,,**PFIZER SAYS ONLY 8% OF SUBJECTS TURNED INTO ZOMBIES; FDA READY TO MOVE FORWARD,"Yo just woke up from a B12 deficiency induced coma, did my BYND calls print?",chinese NIO go up,Earnings Before Open:,Guys do not FOMO into SOLO. Ive been a follower of the stock for 9 months now. It behaves like a penny stock and pumps like this once every 3 months then tanks to new lows. They havent even sold any of their go karts yet. This is a textbook pump and dump
83,Smart Global Holdings,Never buying puts again. The president literally might die and we are barely red.,7:01pm - UK BRC Retail Sales Monitor (YoY) [2/3 Volatility],"-If donnie wins, it's bullish because he'll pump stonks.","We lost our homes, our jobs and our wives trading FDs, but I guess the real profit was the friends we made along the way.","""Lemme tell ya somethin... if you ain't buying TSLA calls for the earnings run up, you ain't black"" -Sleepy J","So no stimulus in 3 weeks, so stocks go up in an anticipation of stimulus bill in the 4th week.",27 Year old me.. still blasting the same song.. watching my DKNG puts die in premarket,Sir this is the breadline for AAPL call holders,"1.2k comments, Rest In Peace to the fallen 🙌🏻🥺",9:00am - UK BoE MPC Member Cunliffe Speaks [2/3 Volatility],just buy two 50c.,,opps MSFT is tues I think,who's the lucky fella you dumped her for?,Earnings This Week,UPS beat earnings by 23%.,🦗,i mean i don't know how you hold that accountable,Bulls: Priced in baby.,Earnings This Week,Brokerage account just hit 6 figures.,How am I still 100% cash gang. I'd rather be a gay bear.,NIO 50 eod,This is better than sex.,Those Macs with Apple CPU’s being announced today better develop vaccines or some shit or I’m fucked :/,imagine if TSLA hits 420,"WIX, Celsius, Energizer, Inmode, Himax, Nice, Schrodinger",I can't fathom holding any position longer than a few days out. That shit is just boring. I bet you leap holders tuck in your shirts you boomer ass bitches
